{
  "$schema": "https://json-schema.org/draft/2020-12/schema",
  "$id": "https://raw.githubusercontent.com/iwizsophy/resolution-guard-nuget/main/nuget-resolution-guard.schema.json",
  "title": "ResolutionGuard.NuGet config",
  "type": "object",
  "additionalProperties": false,
  "properties": {
    "$schema": {
      "type": "string",
      "format": "uri"
    },
    "mode": {
      "type": "string",
      "enum": ["off", "info", "warning", "error"]
    },
    "scope": {
      "type": "string",
      "enum": ["repository", "solution"]
    },
    "directOnly": {
      "type": "boolean"
    },
    "runtimeOnly": {
      "type": "boolean"
    },
    "includeEntrypoints": {
      "type": "array",
      "items": {
        "type": "string",
        "minLength": 1
      },
      "uniqueItems": true
    },
    "excludeEntrypoints": {
      "type": "array",
      "items": {
        "type": "string",
        "minLength": 1
      },
      "uniqueItems": true
    },
    "includePackageIds": {
      "type": "array",
      "items": {
        "type": "string",
        "minLength": 1
      },
      "uniqueItems": true
    },
    "excludePackageIds": {
      "type": "array",
      "items": {
        "type": "string",
        "minLength": 1
      },
      "uniqueItems": true
    },
    "rules": {
      "type": "array",
      "items": {
        "type": "object",
        "additionalProperties": false,
        "properties": {
          "packageId": {
            "type": "string",
            "minLength": 1
          },
          "mode": {
            "type": "string",
            "enum": ["off", "info", "warning", "error"]
          },
          "versions": {
            "type": "array",
            "items": {
              "type": "string",
              "minLength": 1
            },
            "uniqueItems": true
          }
        },
        "required": ["packageId", "mode"]
      }
    }
  }
}
